

{
    "$schema": "http://json-schema.org/draft-04/schema#",
    "$id": "https://example.com/tdm-schedule.schema.json",
    "title": "TDM Schedule Definition",
    "description": "Schema for Time Division Multiplexing schedule configuration",
    "type": "object",
    "required": ["name", "time_unit", "tick_period", "cycle_period", "tasks"],
    "properties": {
        "name": {
            "description": "Name of the schedule",
            "type": "string"
        },
        "description": {
            "description": "Arbitrary string field description",
            "type": "string"
        },
        "time_unit": {
            "description": "Time unit for all period and time measurements",
            "type": "string",
            "enum": ["microseconds", "milliseconds", "seconds"]
        },
        "tick_period": {
            "description": "Fundamental time period of the schedule, expressed in time_unit",
            "type": "number",
            "minimum": 0,
            "exclusiveMinimum": true
        },
        "cycle_period": {
            "description": "Total cycle time of the schedule, expressed in time_unit",
            "type": "number",
            "minimum": 0,
            "exclusiveMinimum": true
        },
        "sub_cycle_period": {
            "description": "Optional sub-period within the main cycle, expressed in time_unit, useful for 2D matrix visualization",
            "type": "number",
            "minimum": 0,
            "exclusiveMinimum": true
        },
        "tasks": {
            "description": "List of tasks in the schedule",
            "type": "array",
            "minItems": 1,
            "items": {
                "type": "object",
                "required": ["task_name", "task_assigned_time", "task_execution_period", "task_execution_start_time"],
                "properties": {
                    "task_name": {
                        "description": "Name of task",
                        "type": "string"
                    },
                    "task_assigned_time": {
                        "description": "Time quanta (ticks) assigned for one execution of this task. An integer count of quanta, not a duration; the wall-clock time is task_assigned_time * tick_period.",
                        "type": "integer",
                        "minimum": 1
                    },
                    "task_execution_period": {
                        "description": "Time quanta (ticks) between successive executions. An integer count of quanta, not a duration; the wall-clock period is task_execution_period * tick_period. A value of 0 means single-shot: the task runs exactly once per cycle (period == cycle length in quanta).",
                        "type": "integer",
                        "minimum": 0
                    },
                    "task_execution_start_time": {
                        "description": "Offset of the task's first execution, in time quanta (ticks) from the start of its period. An integer count of quanta, not a duration; the wall-clock offset is task_execution_start_time * tick_period.",
                        "type": "integer",
                        "minimum": 0
                    }
                },
                "additionalProperties": false
            }
        }
    },
    "additionalProperties": false
}
